{
  "project": "DEVFOLIO OS",
  "phase": "03.7",
  "date": "2026-10-23",
  "status": "CANDIDATE_HANDOFF_NOT_OWNER_APPROVED",
  "source_branch": "docs/phase03-06-devsecops-infrastructure-20261023",
  "main_snapshot_sha": "03a56b549102077b03b6bc8b392418d5381e65d3",
  "qa": {
    "historical_phase03_cases": 318,
    "integration_review_cases": 50,
    "execution": "NOT_RUN"
  },
  "approval": {
    "srs": "PENDING",
    "phase03_7_owner": "PENDING"
  },
  "gates_open": 20
}
